[
  {
    "id": "kwo2025-1373",
    "url": "https://www.swiss-ski-kwo.ch/tk/ranglisten/2025/1373.pdf",
    "status": "processed",
    "event": {
      "startDate": "2025-01-11",
      "endDate": "2025-01-11"
    },
    "crawlPolicy": {
      "validFrom": "2025-01-11T00:00:00Z",
      "validUntil": "2026-01-11T23:59:59Z"
    },
    "tracking": {
      "createdAt": "2025-08-29T21:45:00Z",
      "updatedAt": "2025-08-30T21:04:58.259182+00:00",
      "attemptCount": 5,
      "lastAttemptAt": "2025-08-30T21:04:58.259182+00:00",
      "succeededAt": "2025-08-30T21:04:58.259182+00:00"
    }
  },
  {
    "id": "kwo2025-1388",
    "url": "https://www.swiss-ski-kwo.ch/tk/ranglisten/2025/1388.pdf",
    "status": "processed",
    "event": {
      "startDate": "2025-01-19",
      "endDate": "2025-01-19"
    },
    "crawlPolicy": {
      "validFrom": "2025-01-19T00:00:00Z",
      "validUntil": "2026-01-19T23:59:59Z"
    },
    "tracking": {
      "createdAt": "2025-08-29T21:45:00Z",
      "updatedAt": "2025-08-30T21:04:58.259182+00:00",
      "attemptCount": 5,
      "lastAttemptAt": "2025-08-30T21:04:58.259182+00:00",
      "succeededAt": "2025-08-30T21:04:58.259182+00:00"
    }
  },
  {
    "id": "kwo2025-1380",
    "url": "https://www.swiss-ski-kwo.ch/tk/ranglisten/2025/1380.pdf",
    "status": "processed",
    "event": {
      "startDate": "2025-01-26",
      "endDate": "2025-01-26"
    },
    "crawlPolicy": {
      "validFrom": "2025-01-26T00:00:00Z",
      "validUntil": "2026-01-26T23:59:59Z"
    },
    "tracking": {
      "createdAt": "2025-08-29T21:45:00Z",
      "updatedAt": "2025-08-30T21:52:42.180839+00:00",
      "attemptCount": 3,
      "lastAttemptAt": "2025-08-30T21:52:42.180839+00:00",
      "succeededAt": "2025-08-30T21:52:42.180839+00:00"
    }
  },
  {
    "id": "kwo2025-1105",
    "url": "https://www.swiss-ski-kwo.ch/tk/ranglisten/2025/1105.pdf",
    "status": "processed",
    "event": {
      "startDate": "2025-03-16",
      "endDate": "2025-03-16"
    },
    "crawlPolicy": {
      "validFrom": "2025-03-16T00:00:00Z",
      "validUntil": "2026-03-16T23:59:59Z"
    },
    "tracking": {
      "createdAt": "2025-08-29T21:45:00Z",
      "updatedAt": "2025-08-30T21:52:42.180839+00:00",
      "attemptCount": 3,
      "lastAttemptAt": "2025-08-30T21:52:42.180839+00:00",
      "succeededAt": "2025-08-30T21:52:42.180839+00:00"
    }
  },
  {
    "id": "kwo2025-1396",
    "url": "https://www.swiss-ski-kwo.ch/tk/ranglisten/2025/1396.pdf",
    "status": "processed",
    "event": {
      "startDate": "2025-01-25",
      "endDate": "2025-01-25"
    },
    "crawlPolicy": {
      "validFrom": "2025-01-25T00:00:00Z",
      "validUntil": "2026-01-25T23:59:59Z"
    },
    "tracking": {
      "createdAt": "2025-08-29T21:45:00Z",
      "updatedAt": "2025-08-30T21:52:42.180839+00:00",
      "attemptCount": 3,
      "lastAttemptAt": "2025-08-30T21:52:42.180839+00:00",
      "succeededAt": "2025-08-30T21:52:42.180839+00:00"
    }
  },
  {
    "id": "kwo2025-1050",
    "url": "https://www.swiss-ski-kwo.ch/tk/ranglisten/2025/1050.pdf",
    "status": "processed",
    "event": {
      "startDate": "2025-02-01",
      "endDate": "2025-02-01"
    },
    "crawlPolicy": {
      "validFrom": "2025-02-01T00:00:00Z",
      "validUntil": "2026-02-01T23:59:59Z"
    },
    "tracking": {
      "createdAt": "2025-08-30T01:07:30Z",
      "updatedAt": "2025-08-30T22:21:20.839208+00:00",
      "attemptCount": 4,
      "lastAttemptAt": "2025-08-30T22:21:20.839208+00:00",
      "succeededAt": "2025-08-30T22:21:20.839208+00:00"
    }
  }
]